{
  "schemaVersion": 1,
  "kind": "dronedream-composite-installation",
  "inventoryVersion": "1.0.0",
  "sourceCommit": "6b50f86ed80c190b816f19d06de143a328bda7e2",
  "commonCoreHash": "bbbbbbbbbbbbbbbbbbbbbbbbbbbbbbbbbbbbbbbbbbbbbbbbbbbbbbbbbbbbbbbb",
  "productDisplayVersion": "1.0.0",
  "edition": {
    "editionId": "sim",
    "editionVersion": "1.0.0",
    "manifestSha256": "5d87fe593d456df7c67ddd26da0fa95620742c377fcb5f8caf5d3d299ca20f07"
  },
  "region": "global",
  "targetArchitecture": "windows-x86_64",
  "components": {
    "desktop": {
      "componentId": "desktop-core",
      "version": "1.0.0",
      "buildId": "fixture-desktop",
      "sourceCommit": "6b50f86ed80c190b816f19d06de143a328bda7e2",
      "manifestSha256": "1111111111111111111111111111111111111111111111111111111111111111",
      "artifactSha256": "2222222222222222222222222222222222222222222222222222222222222222",
      "artifactBytes": 10,
      "signatureState": "not-issued",
      "validationTier": "contract-fixture"
    },
    "runtimeBase": {
      "componentId": "runtime-base",
      "version": "0.1.0",
      "buildId": "fixture-runtime",
      "sourceCommit": "6b50f86ed80c190b816f19d06de143a328bda7e2",
      "manifestSha256": "3333333333333333333333333333333333333333333333333333333333333333",
      "artifactSha256": "4444444444444444444444444444444444444444444444444444444444444444",
      "artifactBytes": 20,
      "signatureState": "verified",
      "validationTier": "contract-fixture"
    },
    "enginePack": {
      "componentId": "engine-pack",
      "version": "1.0.0",
      "buildId": "fixture-engine",
      "sourceCommit": "6b50f86ed80c190b816f19d06de143a328bda7e2",
      "manifestSha256": "5555555555555555555555555555555555555555555555555555555555555555",
      "artifactSha256": "6666666666666666666666666666666666666666666666666666666666666666",
      "artifactBytes": 30,
      "signatureState": "verified",
      "validationTier": "contract-fixture"
    }
  },
  "vehiclePacks": [
    {
      "packId": "fixture-x500-contract",
      "packVersion": "1.0.0",
      "manifestSha256": "f174cd7bb65dddfe6645657c7e1f42d5f888b04a2912e6f63bb1b24e0af7ac74",
      "payloadSha256": "aaaaaaaaaaaaaaaaaaaaaaaaaaaaaaaaaaaaaaaaaaaaaaaaaaaaaaaaaaaaaaaa",
      "artifactSha256": "7777777777777777777777777777777777777777777777777777777777777777",
      "artifactBytes": 0,
      "signatureState": "not-issued",
      "validationTier": "contract-only"
    }
  ],
  "selectedModules": [
    "desktop-core",
    "engine-pack",
    "runtime-core",
    "runtime-simulation",
    "simulator-gazebo-harmonic",
    "simulator-px4-sitl",
    "vehicle-pack-sim",
    "vehicle-pack-validation"
  ],
  "capabilities": [
    "qualification.simulation.issue",
    "simulation.execute",
    "simulation.parameter.write",
    "simulation.vehicle.arm",
    "updater.module.apply",
    "vehicle-pack.install"
  ],
  "resourceEstimate": {
    "downloadBytes": 60,
    "installedBytes": 120,
    "requiresWsl": true,
    "requiresGazebo": true
  },
  "installability": {
    "state": "planned",
    "blockers": [
      "The synthetic Vehicle Pack is contract-only and unsigned.",
      "Fixture component artifacts do not exist."
    ],
    "physicalCapabilityStatus": "disabled"
  },
  "licenseNotice": {
    "path": "licenses/THIRD_PARTY_NOTICES.md",
    "sha256": "8888888888888888888888888888888888888888888888888888888888888888",
    "sizeBytes": 10
  }
}
